{
  "schemaVersion": "1.0.0",
  "id": "a-plus-220-1202",
  "name": "CompTIA A+ Core 2",
  "vendor": "CompTIA",
  "examCode": "220-1202",
  "version": "220-1202",
  "status": "active",
  "domains": [
    "operating-systems",
    "security",
    "software-troubleshooting",
    "operational-procedures"
  ],
  "objectiveManifest": "content/objectives/a-plus-220-1202.json",
  "lessonManifest": "content/lessons/a-plus-220-1202/lessons.json",
  "knowledgeIndex": "content/indexes/knowledge-index.json",
  "relationshipGraph": "content/relationships/a-plus-220-1202.graph.json",
  "assessmentRoot": "content/assessments/a-plus-220-1202",
  "notes": "Initial content source is Professor Messer A+ Core 2 220-1202 transcript ingestion."
}
